{"schema":"testing-design.candidate-test-case-set.v1","candidate_set_id":"candidate-set-browser-title-v1","request_digest":"cb410d00e97011ba14e43996037e4fac6ad4b9aee29ae83058697dd8ba48cf6e","status":"candidate","candidates":[{"candidate_id":"TC-HOME-TITLE-001","title":"Home page has the expected title","kind":"browser-smoke","status":"candidate","preconditions":[{"kind":"application-base-url","ref":"application.base_url"}],"steps":[{"step_id":"step-1","action":{"catalog_id":"testing-design.browser-actions","catalog_version":"1.0.0","action_id":"browser.navigate.v1","target":{"kind":"route","ref":"/"}},"assertion":{"catalog_id":"testing-design.browser-assertions","catalog_version":"1.0.0","assertion_id":"browser.title.equals.v1","expected":"Acme Home"}}],"evidence_requirements":[{"kind":"browser-screenshot","when":"after-step","step_id":"step-1"}],"traceability":{"requirement_refs":[{"kind":"requirement","ref":"REQ-HOME-TITLE","sha256":"2222222222222222222222222222222222222222222222222222222222222222"}],"journey_refs":[],"risk_refs":[],"source_refs":[{"kind":"artifact","ref":".testing/runs/design/requirements-index.v1.json","sha256":"bbbbbbbbbbbbbbbbbbbbbbbbbbbbbbbbbbbbbbbbbbbbbbbbbbbbbbbbbbbbbbbb"}],"existing_test_refs":[]}}]}
